slug,title,category,tags,summary,col_labels,compare_rows,article_title,article_lead,exam_points,common_mistakes,memory_tip,related_terms,faq_1_question,faq_1_answer,faq_2_question,faq_2_answer,faq_3_question,faq_3_answer,faq_4_question,faq_4_answer
health-exam-followup-compare-s41,健康診断事後措置の比較（S41）,労働衛生,健康診断;事後措置,健康診断事後措置の比較整理で試験頻出論点を軸ごとに整理します。,論点A;論点B,"[{""axis"": ""論点A"", ""cols"": [""定期健康診断"", ""二次健康診断""]}, {""axis"": ""論点B"", ""cols"": [""二次健康診断"", ""健康診断結果の本人通知""]}]",健康診断事後措置の比較整理｜S41,健康診断事後措置は義務主体・実施手順・記録保存の順で整理すると得点が安定します。,定期健康診断;二次健康診断;記録確認,主体と手順の混同;記録省略;報告漏れ,健康診断事後措置は手順順序を固定して覚える。,定期健康診断;二次健康診断;定期健康診断,「健康診断事後措置の比較（S41）」の試験での位置づけは？,健康診断事後措置は義務主体・実施手順・記録保存の順で整理すると得点が安定します。 試験では定期健康診断を軸に、関連条文・数値・主体の取り違えを照合してください。 過去問で正誤の型を分類し、試験要項で数値・期限を照合してください。,「健康診断事後措置の比較（S41）」でよくある誤答パターンは？,試験論点・条文・数値の対応を比較表に整理し、過去問で正誤の型を分類してください。 過去問で正誤の型を分類し、試験要項で数値・期限を照合してください。 試験では定期健康診断をセットで確認してください。 誤答では主体と手順の混同に注意してください。,「健康診断事後措置の比較（S41）」の覚え方・確認手順は？,試験論点・条文・数値の対応を比較表に整理し、過去問で正誤の型を分類してください。 過去問で正誤の型を分類し、試験要項で数値・期限を照合してください。 試験では定期健康診断をセットで確認してください。 誤答では主体と手順の混同に注意してください。,「健康診断事後措置の比較（S41）」の公式情報はどこで確認しますか？,試験論点・条文・数値の対応を比較表に整理し、過去問で正誤の型を分類してください。 過去問で正誤の型を分類し、試験要項で数値・期限を照合してください。 試験では定期健康診断をセットで確認してください。 誤答では主体と手順の混同に注意してください。
safety-edu-plan-compare-s41,安全衛生教育計画の比較（S41）,関係法令,安全衛生教育;計画,安全衛生教育計画の比較整理で試験頻出論点を軸ごとに整理します。,対象;手順;記録,"[{""axis"": ""論点A"", ""cols"": [""安全衛生教育"", ""特別教育"", ""技能講習""]}, {""axis"": ""論点B"", ""cols"": [""特別教育"", ""技能講習"", ""安全衛生教育""]}, {""axis"": ""論点C"", ""cols"": [""技能講習"", ""安全衛生教育"", ""特別教育""]}]",安全衛生教育計画の比較整理｜S41,安全衛生教育計画は義務主体・実施手順・記録保存の順で整理すると得点が安定します。,安全衛生教育;特別教育;記録確認,主体と手順の混同;記録省略;報告漏れ,安全衛生教育計画は手順順序を固定して覚える。,安全衛生教育;特別教育;技能講習,「安全衛生教育計画の比較（S41）」の試験での位置づけは？,安全衛生教育計画は義務主体・実施手順・記録保存の順で整理すると得点が安定します。 試験では安全衛生教育を軸に、関連条文・数値・主体の取り違えを照合してください。 過去問で正誤の型を分類し、試験要項で数値・期限を照合してください。,「安全衛生教育計画の比較（S41）」でよくある誤答パターンは？,試験論点・条文・数値の対応を比較表に整理し、過去問で正誤の型を分類してください。 過去問で正誤の型を分類し、試験要項で数値・期限を照合してください。 試験では安全衛生教育をセットで確認してください。 誤答では主体と手順の混同に注意してください。,「安全衛生教育計画の比較（S41）」の覚え方・確認手順は？,試験論点・条文・数値の対応を比較表に整理し、過去問で正誤の型を分類してください。 過去問で正誤の型を分類し、試験要項で数値・期限を照合してください。 試験では安全衛生教育をセットで確認してください。 誤答では主体と手順の混同に注意してください。,「安全衛生教育計画の比較（S41）」の公式情報はどこで確認しますか？,試験論点・条文・数値の対応を比較表に整理し、過去問で正誤の型を分類してください。 過去問で正誤の型を分類し、試験要項で数値・期限を照合してください。 試験では安全衛生教育をセットで確認してください。 誤答では主体と手順の混同に注意してください。
committee-minutes-compare-s41,委員会議事の比較（S41）,労働衛生,衛生委員会;議事,委員会議事の比較整理で試験頻出論点を軸ごとに整理します。,対象;手順;記録,"[{""axis"": ""論点A"", ""cols"": [""衛生委員会"", ""安全衛生委員会"", ""産業医""]}, {""axis"": ""論点B"", ""cols"": [""安全衛生委員会"", ""産業医"", ""衛生委員会""]}, {""axis"": ""論点C"", ""cols"": [""産業医"", ""衛生委員会"", ""安全衛生委員会""]}]",委員会議事の比較整理｜S41,委員会議事は義務主体・実施手順・記録保存の順で整理すると得点が安定します。,衛生委員会;安全衛生委員会;記録確認,主体と手順の混同;記録省略;報告漏れ,委員会議事は手順順序を固定して覚える。,衛生委員会;安全衛生委員会;産業医,「委員会議事の比較（S41）」の試験での位置づけは？,委員会議事は義務主体・実施手順・記録保存の順で整理すると得点が安定します。 試験では衛生委員会を軸に、関連条文・数値・主体の取り違えを照合してください。 過去問で正誤の型を分類し、試験要項で数値・期限を照合してください。,「委員会議事の比較（S41）」でよくある誤答パターンは？,試験論点・条文・数値の対応を比較表に整理し、過去問で正誤の型を分類してください。 過去問で正誤の型を分類し、試験要項で数値・期限を照合してください。 試験では衛生委員会をセットで確認してください。 誤答では主体と手順の混同に注意してください。,「委員会議事の比較（S41）」の覚え方・確認手順は？,試験論点・条文・数値の対応を比較表に整理し、過去問で正誤の型を分類してください。 過去問で正誤の型を分類し、試験要項で数値・期限を照合してください。 試験では衛生委員会をセットで確認してください。 誤答では主体と手順の混同に注意してください。,「委員会議事の比較（S41）」の公式情報はどこで確認しますか？,試験論点・条文・数値の対応を比較表に整理し、過去問で正誤の型を分類してください。 過去問で正誤の型を分類し、試験要項で数値・期限を照合してください。 試験では衛生委員会をセットで確認してください。 誤答では主体と手順の混同に注意してください。
ppe-mgmt-compare-s41,保護具管理の比較（S41）,労働衛生,保護具;管理,保護具管理の比較整理で試験頻出論点を軸ごとに整理します。,論点A;論点B,"[{""axis"": ""論点A"", ""cols"": [""呼吸用保護具の選定と着用適合性検査"", ""保護具着用適合性検査""]}, {""axis"": ""論点B"", ""cols"": [""保護具着用適合性検査"", ""個人用保護具""]}]",保護具管理の比較整理｜S41,保護具管理は義務主体・実施手順・記録保存の順で整理すると得点が安定します。,呼吸用保護具の選定と着用適合性検査;保護具着用適合性検査;記録確認,主体と手順の混同;記録省略;報告漏れ,保護具管理は手順順序を固定して覚える。,呼吸用保護具の選定と着用適合性検査;保護具着用適合性検査;個人用保護具,「保護具管理の比較（S41）」の試験での位置づけは？,保護具管理は義務主体・実施手順・記録保存の順で整理すると得点が安定します。 試験では呼吸用保護具の選定と着用適合性検査を軸に、関連条文・数値・主体の取り違えを照合してください。 過去問で正誤の型を分類し、試験要項で数値・期限を照合してください。,「保護具管理の比較（S41）」でよくある誤答パターンは？,主体と手順の混同;記録省略;報告漏れ 誤答肢では保護具着用適合性検査の主語や条件が入れ替わることが多いので、比較表で整理してください。 過去問で正誤の型を分類し、試験要項で数値・期限を照合してください。,「保護具管理の比較（S41）」の覚え方・確認手順は？,試験論点・条文・数値の対応を比較表に整理し、過去問で正誤の型を分類してください。 過去問で正誤の型を分類し、試験要項で数値・期限を照合してください。 試験では呼吸用保護具の選定と着用適合性検査をセットで確認してください。,「保護具管理の比較（S41）」の公式情報はどこで確認しますか？,試験論点・条文・数値の対応を比較表に整理し、過去問で正誤の型を分類してください。 過去問で正誤の型を分類し、試験要項で数値・期限を照合してください。 試験では呼吸用保護具の選定と着用適合性検査をセットで確認してください。
noise-hearing-mgmt-compare-s41,騒音聴力管理の比較（S41）,労働衛生,騒音;聴力,騒音聴力管理の比較整理で試験頻出論点を軸ごとに整理します。,対象;手順;記録,"[{""axis"": ""論点A"", ""cols"": [""等価騒音レベル（LAeq）"", ""聴力保護具（耳栓・耳当て）"", ""A特性騒音レベル""]}, {""axis"": ""論点B"", ""cols"": [""聴力保護具（耳栓・耳当て）"", ""A特性騒音レベル"", ""等価騒音レベル（LAeq）""]}, {""axis"": ""論点C"", ""cols"": [""A特性騒音レベル"", ""等価騒音レベル（LAeq）"", ""聴力保護具（耳栓・耳当て）""]}]",騒音聴力管理の比較整理｜S41,騒音聴力管理は義務主体・実施手順・記録保存の順で整理すると得点が安定します。,等価騒音レベル（LAeq）;聴力保護具（耳栓・耳当て）;記録確認,主体と手順の混同;記録省略;報告漏れ,騒音聴力管理は手順順序を固定して覚える。,等価騒音レベル（LAeq）;聴力保護具（耳栓・耳当て）;A特性騒音レベル,「騒音聴力管理の比較（S41）」の試験での位置づけは？,騒音聴力管理は義務主体・実施手順・記録保存の順で整理すると得点が安定します。 試験では等価騒音レベル（LAeq）を軸に、関連条文・数値・主体の取り違えを照合してください。 過去問で正誤の型を分類し、試験要項で数値・期限を照合してください。,「騒音聴力管理の比較（S41）」でよくある誤答パターンは？,主体と手順の混同;記録省略;報告漏れ 誤答肢では聴力保護具（耳栓・耳当て）の主語や条件が入れ替わることが多いので、比較表で整理してください。 過去問で正誤の型を分類し、試験要項で数値・期限を照合してください。,「騒音聴力管理の比較（S41）」の覚え方・確認手順は？,試験論点・条文・数値の対応を比較表に整理し、過去問で正誤の型を分類してください。 過去問で正誤の型を分類し、試験要項で数値・期限を照合してください。 試験では等価騒音レベル（LAeq）をセットで確認してください。,「騒音聴力管理の比較（S41）」の公式情報はどこで確認しますか？,試験論点・条文・数値の対応を比較表に整理し、過去問で正誤の型を分類してください。 過去問で正誤の型を分類し、試験要項で数値・期限を照合してください。 試験では等価騒音レベル（LAeq）をセットで確認してください。
vibration-mgmt-compare-s41,振動管理の比較（S41）,労働衛生,振動;管理,振動管理の比較整理で試験頻出論点を軸ごとに整理します。,対象;手順;記録,"[{""axis"": ""論点A"", ""cols"": [""振動障害"", ""手先振動"", ""振動の評価""]}, {""axis"": ""論点B"", ""cols"": [""手先振動"", ""振動の評価"", ""振動障害""]}, {""axis"": ""論点C"", ""cols"": [""振動の評価"", ""振動障害"", ""手先振動""]}]",振動管理の比較整理｜S41,振動管理は義務主体・実施手順・記録保存の順で整理すると得点が安定します。,振動障害;手先振動;記録確認,主体と手順の混同;記録省略;報告漏れ,振動管理は手順順序を固定して覚える。,振動障害;手先振動;振動の評価,「振動管理の比較（S41）」の試験での位置づけは？,振動管理は義務主体・実施手順・記録保存の順で整理すると得点が安定します。 試験では振動障害を軸に、関連条文・数値・主体の取り違えを照合してください。 過去問で正誤の型を分類し、試験要項で数値・期限を照合してください。,「振動管理の比較（S41）」でよくある誤答パターンは？,試験論点・条文・数値の対応を比較表に整理し、過去問で正誤の型を分類してください。 過去問で正誤の型を分類し、試験要項で数値・期限を照合してください。 試験では振動障害をセットで確認してください。 誤答では主体と手順の混同に注意してください。,「振動管理の比較（S41）」の覚え方・確認手順は？,試験論点・条文・数値の対応を比較表に整理し、過去問で正誤の型を分類してください。 過去問で正誤の型を分類し、試験要項で数値・期限を照合してください。 試験では振動障害をセットで確認してください。 誤答では主体と手順の混同に注意してください。,「振動管理の比較（S41）」の公式情報はどこで確認しますか？,試験論点・条文・数値の対応を比較表に整理し、過去問で正誤の型を分類してください。 過去問で正誤の型を分類し、試験要項で数値・期限を照合してください。 試験では振動障害をセットで確認してください。 誤答では主体と手順の混同に注意してください。
record-retention-period-compare-s41,記録保存期間の比較（S41）,関係法令,記録;保存期間,記録保存期間の比較整理で試験頻出論点を軸ごとに整理します。,対象;手順;記録,"[{""axis"": ""論点A"", ""cols"": [""第二種衛生管理者試験 総まとめ：数値・頻度・保存期間一覧"", ""作業環境測定記録"", ""個人別の健康診断結果等の記録""]}, {""axis"": ""論点B"", ""cols"": [""作業環境測定記録"", ""個人別の健康診断結果等の記録"", ""第二種衛生管理者試験 総まとめ：数値・頻度・保存期間一覧""]}, {""axis"": ""論点C"", ""cols"": [""個人別の健康診断結果等の記録"", ""第二種衛生管理者試験 総まとめ：数値・頻度・保存期間一覧"", ""作業環境測定記録""]}]",記録保存期間の比較整理｜S41,記録保存期間は義務主体・実施手順・記録保存の順で整理すると得点が安定します。,第二種衛生管理者試験 総まとめ：数値・頻度・保存期間一覧;作業環境測定記録;記録確認,主体と手順の混同;記録省略;報告漏れ,記録保存期間は手順順序を固定して覚える。,第二種衛生管理者試験 総まとめ：数値・頻度・保存期間一覧;作業環境測定記録;個人別の健康診断結果等の記録,「記録保存期間の比較（S41）」の試験での位置づけは？,記録保存期間は義務主体・実施手順・記録保存の順で整理すると得点が安定します。 試験では第二種衛生管理者試験 総まとめ：数値・頻度・保存期間一覧を軸に、関連条文・数値・主体の取り違えを照合してください。,「記録保存期間の比較（S41）」でよくある誤答パターンは？,試験論点・条文・数値の対応を比較表に整理し、過去問で正誤の型を分類してください。 過去問で正誤の型を分類し、試験要項で数値・期限を照合してください。 試験では第二種衛生管理者試験 総まとめ：数値・頻度・保存期間一覧をセットで確認してください。,「記録保存期間の比較（S41）」の覚え方・確認手順は？,試験論点・条文・数値の対応を比較表に整理し、過去問で正誤の型を分類してください。 過去問で正誤の型を分類し、試験要項で数値・期限を照合してください。 試験では第二種衛生管理者試験 総まとめ：数値・頻度・保存期間一覧をセットで確認してください。,「記録保存期間の比較（S41）」の公式情報はどこで確認しますか？,試験論点・条文・数値の対応を比較表に整理し、過去問で正誤の型を分類してください。 過去問で正誤の型を分類し、試験要項で数値・期限を照合してください。 試験では第二種衛生管理者試験 総まとめ：数値・頻度・保存期間一覧をセットで確認してください。
risk-assess-impl-compare-s42,リスクアセスメント実施の比較（S42）,労働衛生,リスクアセスメント;実施,リスクアセスメント実施の比較整理で試験頻出論点を軸ごとに整理します。,対象;手順;記録,"[{""axis"": ""論点A"", ""cols"": [""リスクアセスメント"", ""化学物質"", ""化学物質等による危険性等の調査等""]}, {""axis"": ""論点B"", ""cols"": [""化学物質"", ""化学物質等による危険性等の調査等"", ""リスクアセスメント""]}, {""axis"": ""論点C"", ""cols"": [""化学物質等による危険性等の調査等"", ""リスクアセスメント"", ""化学物質""]}]",リスクアセスメント実施の比較整理｜S42,リスクアセスメント実施は義務主体・実施手順・記録保存の順で整理すると得点が安定します。,リスクアセスメント;化学物質;記録確認,主体と手順の混同;記録省略;報告漏れ,リスクアセスメント実施は手順順序を固定して覚える。,リスクアセスメント;化学物質;化学物質等による危険性等の調査等,「リスクアセスメント実施の比較（S42）」の試験での位置づけは？,リスクアセスメント実施は義務主体・実施手順・記録保存の順で整理すると得点が安定します。 試験ではリスクアセスメントを軸に、関連条文・数値・主体の取り違えを照合してください。 過去問で正誤の型を分類し、試験要項で数値・期限を照合してください。,「リスクアセスメント実施の比較（S42）」でよくある誤答パターンは？,試験論点・条文・数値の対応を比較表に整理し、過去問で正誤の型を分類してください。 過去問で正誤の型を分類し、試験要項で数値・期限を照合してください。 試験ではリスクアセスメントをセットで確認してください。,「リスクアセスメント実施の比較（S42）」の覚え方・確認手順は？,試験論点・条文・数値の対応を比較表に整理し、過去問で正誤の型を分類してください。 過去問で正誤の型を分類し、試験要項で数値・期限を照合してください。 試験ではリスクアセスメントをセットで確認してください。,「リスクアセスメント実施の比較（S42）」の公式情報はどこで確認しますか？,試験論点・条文・数値の対応を比較表に整理し、過去問で正誤の型を分類してください。 過去問で正誤の型を分類し、試験要項で数値・期限を照合してください。 試験ではリスクアセスメントをセットで確認してください。
chem-mgmt-record-compare-s42,化学物質管理記録の比較（S42）,労働衛生,化学物質;記録,化学物質管理記録の比較整理で試験頻出論点を軸ごとに整理します。,対象;手順;記録,"[{""axis"": ""論点A"", ""cols"": [""化学物質"", ""化学物質等による危険性等の調査等"", ""作業環境測定記録""]}, {""axis"": ""論点B"", ""cols"": [""化学物質等による危険性等の調査等"", ""作業環境測定記録"", ""化学物質""]}, {""axis"": ""論点C"", ""cols"": [""作業環境測定記録"", ""化学物質"", ""化学物質等による危険性等の調査等""]}]",化学物質管理記録の比較整理｜S42,化学物質管理記録は義務主体・実施手順・記録保存の順で整理すると得点が安定します。,化学物質;化学物質等による危険性等の調査等;記録確認,主体と手順の混同;記録省略;報告漏れ,化学物質管理記録は手順順序を固定して覚える。,化学物質;化学物質等による危険性等の調査等;作業環境測定記録,「化学物質管理記録の比較（S42）」の試験での位置づけは？,化学物質管理記録は義務主体・実施手順・記録保存の順で整理すると得点が安定します。 試験では化学物質を軸に、関連条文・数値・主体の取り違えを照合してください。 過去問で正誤の型を分類し、試験要項で数値・期限を照合してください。,「化学物質管理記録の比較（S42）」でよくある誤答パターンは？,主体と手順の混同;記録省略;報告漏れ 誤答肢では化学物質等による危険性等の調査等の主語や条件が入れ替わることが多いので、比較表で整理してください。 過去問で正誤の型を分類し、試験要項で数値・期限を照合してください。,「化学物質管理記録の比較（S42）」の覚え方・確認手順は？,試験論点・条文・数値の対応を比較表に整理し、過去問で正誤の型を分類してください。 過去問で正誤の型を分類し、試験要項で数値・期限を照合してください。 試験では化学物質をセットで確認してください。 誤答では主体と手順の混同に注意してください。,「化学物質管理記録の比較（S42）」の公式情報はどこで確認しますか？,試験論点・条文・数値の対応を比較表に整理し、過去問で正誤の型を分類してください。 過去問で正誤の型を分類し、試験要項で数値・期限を照合してください。 試験では化学物質をセットで確認してください。 誤答では主体と手順の混同に注意してください。
