slug,title,category,tags,summary,col_labels,compare_rows,article_title,article_lead,exam_points,common_mistakes,memory_tip,related_terms,faq_1_question,faq_1_answer,faq_2_question,faq_2_answer,faq_3_question,faq_3_answer,faq_4_question,faq_4_answer
daiichi-daini-eisei,第一種と第二種衛生管理者の違い,関係法令,第一種;第二種;有害業務,第一種・第二種の選任事業場・試験範囲・問題数の違いを整理します。,第一種;第二種,"[{""axis"": ""選任"", ""cols"": [""有害業務を行う事業場等"", ""非有害業務の事業場（原則）""]}, {""axis"": ""試験"", ""cols"": [""44問・有害含む5範囲"", ""30問・有害以外3科目""]}, {""axis"": ""合格"", ""cols"": [""400点・240点等"", ""300点・180点等""]}, {""axis"": ""見分け"", ""cols"": [""「有害」「44問」"", ""「30問」「有害以外」""]}, {""axis"": ""混同"", ""cols"": [""二種で有害担当"", ""一種不要""]}]",第一種と第二種衛生管理者の違い｜第二種,第二種試験では両者の比較が定番です。有害業務の有無と問題数の差を表で整理し、第二種は有害以外に絞って学習してください。数値・日程・合格基準は公益財団法人 安全衛生技術試験協会（www.exam.or.jp）の試験要項で必ずご確認ください。,有害業務で一種・二種を区分;二種は30問;一種は44問;選任要件を条文で確認,二種で有害業務を担当;問題数を逆;試験範囲を同一視,「有害＝一種」「非有害＝二種」と整理。,第一種衛生管理者;第二種衛生管理者;有害業務,第二種の選任対象は？,原則として非有害業務の事業場です。有害業務を行う事業場では第一種が必要となる場合があります。条文で確認してください。有害業務で一種・二種を区分。二種は30問。一種は44問。選任要件を条文で確認。「有害＝一種」「非有害＝二種」と整理。,問題数の違いは？,第二種は30問（各10問）、第一種は44問です。合格の総点・科目別基準も異なります。数値・日程・合格基準は公益財団法人 安全衛生技術試験協会（www.exam.or.jp）の試験要項で必ずご確認ください。,試験対策は？,比較表を作成し、第二種の出題範囲のみに絞って過去問演習してください。有害業務で一種・二種を区分。二種は30問。一種は44問。選任要件を条文で確認。「有害＝一種」「非有害＝二種」と整理。誤りやすいのは「二種で有害業務を担当」と捉えることです。,確認先の公式サイトは？,安全衛生技術試験協会（www.exam.or.jp）の試験要項を参照してください。有害業務で一種・二種を区分。二種は30問。一種は44問。選任要件を条文で確認。「有害＝一種」「非有害＝二種」と整理。誤りやすいのは「二種で有害業務を担当」と捉えることです。
sangyou-i-eisei,産業医と衛生管理者の違い,労働衛生,産業医;衛生管理者,産業医と衛生管理者の資格・選任・職務の違いを整理します。,産業医;衛生管理者,"[{""axis"": ""資格"", ""cols"": [""医師免許"", ""衛生管理者免許""]}, {""axis"": ""職務"", ""cols"": [""医学的管理・面接指導等"", ""労働衛生の総括・作業環境等""]}, {""axis"": ""選任"", ""cols"": [""常時50人以上等"", ""規模要件により選任""]}, {""axis"": ""試験"", ""cols"": [""医師が前提"", ""衛生管理者試験""]}, {""axis"": ""混同"", ""cols"": [""衛生管理者が診断実施"", ""産業医が測定実施""]}]",産業医と衛生管理者の違い｜第二種,医学的管理と労働衛生管理は主体が異なります。長時間労働者面接指導など協働する領域も、主たる責任者を条文で区別してください。産業医と衛生管理者の資格・選任・職務の違いを整理します。試験で押さえるべき点は、産業医＝医学的管理、衛生管理者＝労働衛生、選任規模が異なる、職務分担を暗記。,産業医＝医学的管理;衛生管理者＝労働衛生;選任規模が異なる;職務分担を暗記,同一職務とする;選任要件を逆;診断実施者を混同,「医学＝産業医」「労働衛生＝衛生管理者」。,産業医;第二種衛生管理者;衛生管理者の職務・専任・巡視,産業医の役割は？,健康診断結果の医学的管理、長時間労働者面接指導等を担います。医師免許が前提です。産業医＝医学的管理。衛生管理者＝労働衛生。選任規模が異なる。職務分担を暗記。「医学＝産業医」「労働衛生＝衛生管理者」。誤りやすいのは「同一職務とする」と捉えることです。,衛生管理者の役割は？,作業環境の管理、健康保持増進、事故防止等の労働衛生を総括します。専任・巡視も重要です。産業医＝医学的管理。衛生管理者＝労働衛生。選任規模が異なる。職務分担を暗記。「医学＝産業医」「労働衛生＝衛生管理者」。,試験対策は？,選任・職務の正誤問題を反復し、関連用語ページと照合してください。産業医＝医学的管理。衛生管理者＝労働衛生。選任規模が異なる。職務分担を暗記。「医学＝産業医」「労働衛生＝衛生管理者」。誤りやすいのは「同一職務とする」と捉えることです。,面接指導との関係は？,長時間労働者面接指導の役割分担が頻出です。用語集の該当ページを参照してください。産業医＝医学的管理。衛生管理者＝労働衛生。選任規模が異なる。職務分担を暗記。「医学＝産業医」「労働衛生＝衛生管理者」。誤りやすいのは「同一職務とする」と捉えることです。
kyokusho-zenmen-haiki,局所排気装置と全面換気の違い,労働衛生,局所排気;換気,有害物質等の制御における局所排気と全面換気（希釈換気）の違いを整理します。,局所排気装置;全面換気・希釈換気,"[{""axis"": ""原理"", ""cols"": [""発生源を密閉・吸引"", ""室内全体を換気して希釈""]}, {""axis"": ""適用"", ""cols"": [""発生源が明確な作業"", ""広範囲・発散作業等""]}, {""axis"": ""設備"", ""cols"": [""フード・ダクト・送風機"", ""換気量・気流組織""]}, {""axis"": ""試験"", ""cols"": [""「密閉」「吸引」"", ""「換気量」「希釈」""]}, {""axis"": ""混同"", ""cols"": [""全面で局所代替"", ""局所不要""]}]",局所排気と全面換気の違い｜第二種,作業環境管理では第一に局所排気等、必要に応じ全面換気を組み合わせます。優先順位と設計の考え方が試験頻出です。有害物質等の制御における局所排気と全面換気（希釈換気）の違いを整理します。試験で押さえるべき点は、局所排気を優先、全面換気は希釈、換気量計算、組み合わせ。,局所排気を優先;全面換気は希釈;換気量計算;組み合わせ,全面のみで十分;局所排気不要;優先順位逆,「発生源＝局所」「希釈＝全面」。,局所排気装置;全面換気・希釈換気;作業環境測定,局所排気の目的は？,有害物質の発生源を密閉し、吸引して労働者へのばく露を低減します。外付け型等の種類も確認してください。局所排気を優先。全面換気は希釈。換気量計算。組み合わせ。「発生源＝局所」「希釈＝全面」。誤りやすいのは「全面のみで十分」と捉えることです。,全面換気とは？,作業場全体の空気を換気し、有害物質を希釈します。必要換気量の考え方が問われます。局所排気を優先。全面換気は希釈。換気量計算。組み合わせ。「発生源＝局所」「希釈＝全面」。誤りやすいのは「全面のみで十分」と捉えることです。,試験対策は？,優先順位・設備の適否を過去問で確認し、作業環境管理区分とセットで学習してください。局所排気を優先。全面換気は希釈。換気量計算。組み合わせ。「発生源＝局所」「希釈＝全面」。誤りやすいのは「全面のみで十分」と捉えることです。,測定との関係は？,作業環境測定・管理区分と結びつけて整理してください。局所排気を優先。全面換気は希釈。換気量計算。組み合わせ。「発生源＝局所」「希釈＝全面」。誤りやすいのは「全面のみで十分」と捉えることです。有害物質等の制御における局所排気と全面換気（希釈換気）の違いを整理します。
koyou-teiki-kenshin,雇入時健康診断と定期健康診断,労働衛生,雇入時;定期;健康診断,雇入時・定期健康診断の実施時期・目的・事後措置の違いを整理します。,雇入時健康診断;定期健康診断,"[{""axis"": ""時期"", ""cols"": [""雇入れ時（配属前等）"", ""定期（1年以内ごとなど）""]}, {""axis"": ""目的"", ""cols"": [""適性・健康把握"", ""健康管理・早期発見""]}, {""axis"": ""事後措置"", ""cols"": [""就業判定・配慮"", ""再検査・面接指導等""]}, {""axis"": ""試験"", ""cols"": [""「雇入れ」「配属前」"", ""「1年以内」「定期」""]}, {""axis"": ""混同"", ""cols"": [""定期のみで雇入れ可"", ""雇入れ不要""]}]",雇入時と定期健康診断の違い｜第二種,健康診断は労働衛生の中核です。実施時期・項目・保存期間・事後措置を表にまとめ、数値問題と結びつけてください。雇入時・定期健康診断の実施時期・目的・事後措置の違いを整理します。試験で押さえるべき点は、雇入れ時は必須、定期は周期管理、事後措置を区別、記録保存期間。,雇入れ時は必須;定期は周期管理;事後措置を区別;記録保存期間,雇入れ時省略;周期を逆;二次健診と混同,「雇入れ＝適性」「定期＝継続管理」。,雇入時健康診断;定期健康診断;二次健康診断,雇入時健康診断は？,労働者を雇い入れる際、配属前等に実施します。就業の可否判定に関わる結果処理が重要です。雇入れ時は必須。定期は周期管理。事後措置を区別。記録保存期間。「雇入れ＝適性」「定期＝継続管理」。誤りやすいのは「雇入れ時省略」と捉えることです。,定期健康診断は？,在職中の労働者に対し、周期ごとに実施して健康管理を行います。実施時期の数値が頻出です。雇入れ時は必須。定期は周期管理。事後措置を区別。記録保存期間。「雇入れ＝適性」「定期＝継続管理」。誤りやすいのは「雇入れ時省略」と捉えることです。,試験対策は？,総まとめ用語の数値・頻度・保存期間一覧と照合し、正誤問題を反復してください。雇入れ時は必須。定期は周期管理。事後措置を区別。記録保存期間。「雇入れ＝適性」「定期＝継続管理」。誤りやすいのは「雇入れ時省略」と捉えることです。,二次健康診断は？,定期等で必要な場合に実施します。雇入れ時・定期と目的が異なります。雇入れ時は必須。定期は周期管理。事後措置を区別。記録保存期間。「雇入れ＝適性」「定期＝継続管理」。誤りやすいのは「雇入れ時省略」と捉えることです。
ichiji-teiki-sokutei,作業環境測定の種類,労働衛生,作業環境測定;管理区分,作業環境測定の実施区分・記録・評価の違いを整理します。,第1管理区分;第2管理区分,"[{""axis"": ""管理区分"", ""cols"": [""第1〜第3管理区分で頻度等が異なる"", ""物質・作業により区分""]}, {""axis"": ""記録"", ""cols"": [""作業環境測定記録"", ""管理簿への記載""]}, {""axis"": ""評価"", ""cols"": [""管理濃度等と比較"", ""改善措置の要否""]}, {""axis"": ""試験"", ""cols"": [""「管理区分」「頻度」"", ""「記録保存」""]}, {""axis"": ""混同"", ""cols"": [""測定不要"", ""区分を無視""]}]",作業環境測定の種類｜第二種,作業環境管理区分により測定頻度・方法が変わります。管理濃度・測定記録・改善措置を一連で学習してください。作業環境測定の実施区分・記録・評価の違いを整理します。試験で押さえるべき点は、管理区分で頻度が変わる、測定記録保存、管理濃度比較、改善措置。,管理区分で頻度が変わる;測定記録保存;管理濃度比較;改善措置,区分不要;記録不要;測定結果を無視,「区分→頻度→記録→改善」の流れ。,作業環境測定;作業環境測定記録;作業環境管理区分（第1〜第3管理区分）,作業環境測定とは？,有害物等の濃度等を測定し、作業環境を評価・管理するための措置です。管理区分により実施頻度が定められます。管理区分で頻度が変わる。測定記録保存。管理濃度比較。改善措置。「区分→頻度→記録→改善」の流れ。,測定記録の保存は？,作業環境測定記録・作業環境管理簿等への記載が求められます。保存期間も確認してください。管理区分で頻度が変わる。測定記録保存。管理濃度比較。改善措置。「区分→頻度→記録→改善」の流れ。誤りやすいのは「区分不要」と捉えることです。,試験対策は？,管理区分表・頻度数値を暗記し、過去問の正誤肢パターンを整理してください。管理区分で頻度が変わる。測定記録保存。管理濃度比較。改善措置。「区分→頻度→記録→改善」の流れ。誤りやすいのは「区分不要」と捉えることです。,局所排気との関係は？,改善措置として局所排気・換気と結びつけて学習してください。管理区分で頻度が変わる。測定記録保存。管理濃度比較。「区分→頻度→記録→改善」の流れ。誤りやすいのは「区分不要」と捉えることです。作業環境測定の実施区分・記録・評価の違いを整理します。
anzen-eisei-iinkai,安全衛生委員会と衛生委員会,関係法令,安全衛生委員会;衛生委員会,安全衛生委員会・衛生委員会の設置要件・構成・権限の違いを整理します。,安全衛生委員会;衛生委員会,"[{""axis"": ""設置規模"", ""cols"": [""50人以上（原則）"", ""10人以上50人未満等""]}, {""axis"": ""構成"", ""cols"": [""委員長・衛生管理者等"", ""衛生委員・産業医等""]}, {""axis"": ""権限"", ""cols"": [""審議・意見具申"", ""意見聴取・記録等""]}, {""axis"": ""試験"", ""cols"": [""「50人」"", ""「10人」""]}, {""axis"": ""混同"", ""cols"": [""衛生委員会のみで足りる"", ""安全衛生委員会不要""]}]",安全衛生委員会と衛生委員会｜第二種,常時雇用者数により設置する委員会が異なります。人数基準・構成員・会議の記録が関係法令で頻出です。安全衛生委員会・衛生委員会の設置要件・構成・権限の違いを整理します。試験で押さえるべき点は、50人以上は安全衛生委員会、10人以上は衛生委員会、人数基準を暗記、構成・権限の違い。,50人以上は安全衛生委員会;10人以上は衛生委員会;人数基準を暗記;構成・権限の違い,人数基準逆;同一機関;記録不要,「50＝安衛委」「10〜49＝衛生委員会」。,安全衛生委員会;衛生委員会;労働安全衛生法,安全衛生委員会の設置は？,常時50人以上を雇用する事業場で、原則設置が必要です。構成・職務は労働安全衛生法で定められます。50人以上は安全衛生委員会。10人以上は衛生委員会。人数基準を暗記。構成・権限の違い。「50＝安衛委」「10〜49＝衛生委員会」。,衛生委員会は？,10人以上50人未満等の事業場で設置します。規模が小さい事業場向けの制度です。50人以上は安全衛生委員会。10人以上は衛生委員会。人数基準を暗記。構成・権限の違い。「50＝安衛委」「10〜49＝衛生委員会」。,試験対策は？,人数基準・構成・会議記録の正誤を表にまとめ、過去問で確認してください。50人以上は安全衛生委員会。10人以上は衛生委員会。人数基準を暗記。構成・権限の違い。「50＝安衛委」「10〜49＝衛生委員会」。,衛生管理者の関係は？,委員会への参与・意見聴取等、衛生管理者の位置づけも問われます。50人以上は安全衛生委員会。10人以上は衛生委員会。人数基準を暗記。構成・権限の違い。「50＝安衛委」「10〜49＝衛生委員会」。誤りやすいのは「人数基準逆」と捉えることです。
risk-chemical,リスクアセスメントと化学物質管理,労働衛生,リスクアセスメント;化学物質,リスクアセスメントと化学物質等の調査・管理措置の関係を整理します。,リスクアセスメント;化学物質,"[{""axis"": ""目的"", ""cols"": [""ばく露・危険性の見積り"", ""有害性調査・表示・管理""]}, {""axis"": ""手順"", ""cols"": [""ばく露濃度×影響"", ""SDS・表示・代替等""]}, {""axis"": ""義務"", ""cols"": [""一定規模で実施"", ""調査等の義務""]}, {""axis"": ""試験"", ""cols"": [""「見積り」「ばく露」"", ""「SDS」「表示」""]}, {""axis"": ""混同"", ""cols"": [""調査のみで終了"", ""アセスメント不要""]}]",リスクアセスメントと化学物質管理｜第二種,化学物質管理は調査・リスクアセスメント・表示・教育等の組み合わせです。第二種では有害業務以外の範囲で基本手順を押さえます。リスクアセスメントと化学物質等の調査・管理措置の関係を整理します。試験で押さえるべき点は、調査とアセスメントの順、ばく露見積り、SDS・表示、管理措置の選択。,調査とアセスメントの順;ばく露見積り;SDS・表示;管理措置の選択,調査のみ;アセスメント省略;表示不要,「調査→評価→措置」の流れ。,リスクアセスメント;化学物質;化学物質等による危険性等の調査等,リスクアセスメントとは？,化学物質等による危険性・有害性を調査し、ばく露の程度と影響を見積って管理措置を検討する手順です。調査とアセスメントの順。ばく露見積り。SDS・表示。管理措置の選択。「調査→評価→措置」の流れ。誤りやすいのは「調査のみ」と捉えることです。,化学物質管理とは？,SDSの交付、表示、代替・封じ込め等、法令に基づく管理措置を含みます。調査とアセスメントの順。ばく露見積り。SDS・表示。管理措置の選択。「調査→評価→措置」の流れ。誤りやすいのは「調査のみ」と捉えることです。,試験対策は？,手順の順序・義務主体の正誤を過去問で確認してください。調査とアセスメントの順。ばく露見積り。SDS・表示。管理措置の選択。「調査→評価→措置」の流れ。誤りやすいのは「調査のみ」と捉えることです。リスクアセスメントと化学物質等の調査・管理措置の関係を整理します。,特定化学物質は？,第二種範囲外の有害業務に関連するため、第一種との比較で境界を確認してください。調査とアセスメントの順。ばく露見積り。SDS・表示。管理措置の選択。「調査→評価→措置」の流れ。誤りやすいのは「調査のみ」と捉えることです。
stress-kenshin,ストレスチェックと健康診断,関係法令,ストレスチェック;健康診断,メンタルヘルス対策としてのストレスチェック制度と健康診断の違いを整理します。,ストレスチェック制度;定期健康診断,"[{""axis"": ""目的"", ""cols"": [""心理的負担の把握"", ""身体健康の管理""]}, {""axis"": ""実施"", ""cols"": [""事業者が実施・勧告"", ""医師等による健診""]}, {""axis"": ""結果"", ""cols"": [""面接指導・措置"", ""就業判定・二次健診等""]}, {""axis"": ""試験"", ""cols"": [""「ストレス」「50人以上」"", ""「健診」「周期」""]}, {""axis"": ""混同"", ""cols"": [""健診でストレス測定のみ"", ""ストレスチェック不要""]}]",ストレスチェックと健康診断｜第二種,ストレスチェックは労働安全衛生法上のメンタルヘルス措置、健康診断は身体健康管理です。実施者・記録・フォローが異なります。メンタルヘルス対策としてのストレスチェック制度と健康診断の違いを整理します。試験で押さえるべき点は、目的と手続が異なる、50人以上等の要件、面接指導、健診との併用。,目的と手続が異なる;50人以上等の要件;面接指導;健診との併用,同一制度と誤解;健診で代替;実施不要とする,「メンタル＝ストレスチェック」「身体＝健診」。,ストレスチェック制度;定期健康診断;面接指導,ストレスチェックとは？,労働者の心理的負担を把握し、必要に応じ面接指導等を行う制度です。実施要件・手順を確認してください。目的と手続が異なる。50人以上等の要件。健診との併用。「メンタル＝ストレスチェック」「身体＝健診」。誤りやすいのは「同一制度と誤解」と捉えることです。,健康診断との違いは？,健康診断は医学的検査による身体健康の管理です。目的・実施方法・記録が異なります。目的と手続が異なる。50人以上等の要件。面接指導。健診との併用。「メンタル＝ストレスチェック」「身体＝健診」。誤りやすいのは「同一制度と誤解」と捉えることです。,試験対策は？,人数要件・実施時期・医師・産業医の関与を表に整理してください。目的と手続が異なる。50人以上等の要件。面接指導。健診との併用。「メンタル＝ストレスチェック」「身体＝健診」。誤りやすいのは「同一制度と誤解」と捉えることです。,長時間労働との関係は？,長時間労働者面接指導と併せて学習してください。目的と手続が異なる。50人以上等の要件。健診との併用。「メンタル＝ストレスチェック」「身体＝健診」。誤りやすいのは「同一制度と誤解」と捉えることです。メンタルヘルス対策としてのストレスチェック制度と健康診断の違いを整理します。
