slug,title,category,tags,summary,confusion_point,pattern_rows,article_title,article_lead,exam_points,common_mistakes,memory_tip,related_terms,faq_1_question,faq_1_answer,faq_2_question,faq_2_answer,faq_3_question,faq_3_answer,faq_4_question,faq_4_answer
chemical-risk-order-mis-s33,化学物質リスク順序逆転ミス,労働衛生,化学物質;リスクアセスメント,化学物質管理で調査と評価の順序を逆転させるミスを整理します。,表示先行で完了扱い。,"[{""topic"": ""調査"", ""wrong"": ""調査省略"", ""correct"": ""化学物質等による危険性等の調査等を先実施"", ""trap"": ""手順誤り""}, {""topic"": ""評価"", ""wrong"": ""評価不要"", ""correct"": ""リスクアセスメントを実施"", ""trap"": ""評価欠落""}, {""topic"": ""表示"", ""wrong"": ""表示のみで完了"", ""correct"": ""GHS表示は管理の一部"", ""trap"": ""役割誤認""}, {""topic"": ""保護具"", ""wrong"": ""選定不要"", ""correct"": ""個人用保護具を選定"", ""trap"": ""措置不足""}]",化学物質順序逆転ミス対策｜S33,化学物質管理は調査→評価→措置→表示の順を崩さないことが重要です。,調査先行;評価必須;表示位置;保護具,表示だけで管理が終わると誤認し、調査と評価を省いてしまう。,化学管理は順序固定で解く。,化学物質;化学物質等による危険性等の調査等;リスクアセスメント,化学順序ミスの頻出論点は？,化学順序ミスは対象作業、健康影響、管理措置、記録の4点で問われます。設問文の対象者を先に確定し、次に措置と数値を照合する順序で解くと安定します。 試験では調査先行をセットで確認してください。 誤答では表示だけで管理が終わると誤認し、調査と評価を省いてしまう。に注意してください。,覚え方のコツは？,比較表を「原因→評価→措置→記録」で統一し、関連テーマを横断して確認してください。単語暗記だけでなく、実施順序まで固定すると誤答を減らせます。 試験では調査先行をセットで確認してください。 誤答では表示だけで管理が終わると誤認し、調査と評価を省いてしまう。に注意してください。,直前期の対策は？,誤答した選択肢だけを再演習し、同一論点の逆転肢を連続で解く方法が効果的です。新規問題を増やし過ぎず、取りこぼし削減を優先してください。 試験では調査先行をセットで確認してください。 誤答では表示だけで管理が終わると誤認し、調査と評価を省いてしまう。に注意してください。,本番で迷ったときは？,対象作業を確定してから法令キーワードを照合し、最後に数値を確認してください。数値先行で読むと主語を見失いやすいため、判断順序を固定することが重要です。 試験では調査先行をセットで確認してください。 誤答では表示だけで管理が終わると誤認し、調査と評価を省いてしまう。に注意してください。
safety-manager-boundary-mis-s33,安全管理者と衛生管理者の境界混同ミス,関係法令,安全管理者;衛生管理者,安全管理者と衛生管理者の職務境界を混同するミスを整理します。,役割一体化の誤認。,"[{""topic"": ""安全"", ""wrong"": ""衛生管理者が代替"", ""correct"": ""安全管理者が担当"", ""trap"": ""職務誤り""}, {""topic"": ""衛生"", ""wrong"": ""安全管理者が代替"", ""correct"": ""衛生管理者が担当"", ""trap"": ""職務誤り""}, {""topic"": ""医師"", ""wrong"": ""産業医不要"", ""correct"": ""産業医と連携"", ""trap"": ""連携不足""}, {""topic"": ""委員会"", ""wrong"": ""委員会不要"", ""correct"": ""安全衛生委員会で審議"", ""trap"": ""体制不足""}]",役割境界混同ミス対策｜S33,組織問題は役割境界を図で整理すると誤答を防げます。 試験では実務運用まで確認してください。,安全管理者;衛生管理者;産業医;委員会,管理者を一人で兼務可能と短絡し、法定体制の論点を落とす。,体制問題は役割境界を先に引く。,安全管理者;衛生管理者;産業医,役割境界ミスの頻出論点は？,役割境界ミスは対象作業、健康影響、管理措置、記録の4点で問われます。設問文の対象者を先に確定し、次に措置と数値を照合する順序で解くと安定します。 試験では安全管理者をセットで確認してください。 誤答では管理者を一人で兼務可能と短絡し、法定体制の論点を落とす。に注意してください。,覚え方のコツは？,比較表を「原因→評価→措置→記録」で統一し、関連テーマを横断して確認してください。単語暗記だけでなく、実施順序まで固定すると誤答を減らせます。 試験では安全管理者をセットで確認してください。 誤答では管理者を一人で兼務可能と短絡し、法定体制の論点を落とす。に注意してください。,直前期の対策は？,誤答した選択肢だけを再演習し、同一論点の逆転肢を連続で解く方法が効果的です。新規問題を増やし過ぎず、取りこぼし削減を優先してください。 試験では安全管理者をセットで確認してください。 誤答では管理者を一人で兼務可能と短絡し、法定体制の論点を落とす。に注意してください。,本番で迷ったときは？,対象作業を確定してから法令キーワードを照合し、最後に数値を確認してください。数値先行で読むと主語を見失いやすいため、判断順序を固定することが重要です。 試験では安全管理者をセットで確認してください。 誤答では管理者を一人で兼務可能と短絡し、法定体制の論点を落とす。に注意してください。
noise-protection-mis-s34,騒音で保護具のみ運用するミス,労働衛生,騒音;保護具,騒音対策で評価手順を省いて保護具のみ運用するミスを整理します。,評価手順の省略。,"[{""topic"": ""評価"", ""wrong"": ""測定不要"", ""correct"": ""騒音の測定を実施"", ""trap"": ""評価漏れ""}, {""topic"": ""指標"", ""wrong"": ""LAeq不要"", ""correct"": ""等価騒音レベル（LAeq）を確認"", ""trap"": ""指標軽視""}, {""topic"": ""保護具"", ""wrong"": ""耳栓のみ配布"", ""correct"": ""聴力保護具の適切運用"", ""trap"": ""運用不足""}, {""topic"": ""記録"", ""wrong"": ""記録不要"", ""correct"": ""作業環境測定記録を保存"", ""trap"": ""証跡不足""}]",騒音保護具偏重ミス対策｜S34,騒音は評価と保護具運用を同時に行う必要があります。 試験では実務運用まで確認してください。,測定実施;LAeq確認;保護具運用;記録,耳栓を配布したので管理完了と誤認し、評価記録を省く。,騒音対策は評価と保護具をセット化する。,騒音;等価騒音レベル（LAeq）;聴力保護具（耳栓・耳当て）,騒音保護具ミスで最重要の確認点は？,騒音保護具ミスは対象作業、管理措置、記録、教育の順で確認すると誤答が減ります。主語を確定してから数値を確認する手順を固定してください。 試験では測定実施をセットで確認してください。 誤答では耳栓を配布したので管理完了と誤認し、評価記録を省く。に注意してください。,よくあるミスは？,法令名の取り違え、対象作業の過不足、保護具や記録の省略が典型です。比較表を用いて差分を見える化すると実務にも直結します。 試験では測定実施をセットで確認してください。 誤答では耳栓を配布したので管理完了と誤認し、評価記録を省く。に注意してください。,試験直前の学習法は？,誤答肢だけを抜き出し、同一テーマの逆転肢を連続で確認する方法が有効です。新規範囲を広げるより、既出弱点の穴埋めを優先してください。 試験では測定実施をセットで確認してください。 誤答では耳栓を配布したので管理完了と誤認し、評価記録を省く。に注意してください。,本番で迷った場合の対処は？,対象作業を確定したうえで、適用法令、保護具、記録の順に照合してください。いきなり数値へ飛ぶと主語を外しやすいため、判断順序の維持が重要です。 試験では測定実施をセットで確認してください。 誤答では耳栓を配布したので管理完了と誤認し、評価記録を省く。に注意してください。
thermal-balance-mis-s34,高温低温対策の片寄りミス,労働衛生,高温;低温,高温対策のみで低温対策を省く片寄りミスを整理します。,温熱対策の偏り。,"[{""topic"": ""高温"", ""wrong"": ""高温のみ管理"", ""correct"": ""高温低温の双方を管理"", ""trap"": ""片寄り""}, {""topic"": ""低温"", ""wrong"": ""低温は対象外"", ""correct"": ""低温環境リスクを確認"", ""trap"": ""対象漏れ""}, {""topic"": ""評価"", ""wrong"": ""測定不要"", ""correct"": ""作業環境測定を実施"", ""trap"": ""評価不足""}, {""topic"": ""教育"", ""wrong"": ""教育省略"", ""correct"": ""安全衛生教育で周知"", ""trap"": ""周知不足""}]",温熱対策片寄りミス対策｜S34,温熱環境は高温低温を対で管理することが重要です。 試験では実務運用まで確認してください。,高温低温管理;測定;教育;予防,熱中症対策だけで十分と考え、低温環境の配慮措置を落とす。,温熱管理は高温・低温の両面で確認する。,熱中症;作業環境測定;安全衛生教育,温熱片寄りミスで最重要の確認点は？,温熱片寄りミスは対象作業、管理措置、記録、教育の順で確認すると誤答が減ります。主語を確定してから数値を確認する手順を固定してください。 試験では高温低温管理をセットで確認してください。 誤答では熱中症対策だけで十分と考え、低温環境の配慮措置を落とす。に注意してください。,よくあるミスは？,法令名の取り違え、対象作業の過不足、保護具や記録の省略が典型です。比較表を用いて差分を見える化すると実務にも直結します。 試験では高温低温管理をセットで確認してください。 誤答では熱中症対策だけで十分と考え、低温環境の配慮措置を落とす。に注意してください。,試験直前の学習法は？,誤答肢だけを抜き出し、同一テーマの逆転肢を連続で確認する方法が有効です。新規範囲を広げるより、既出弱点の穴埋めを優先してください。 試験では高温低温管理をセットで確認してください。 誤答では熱中症対策だけで十分と考え、低温環境の配慮措置を落とす。に注意してください。,本番で迷った場合の対処は？,対象作業を確定したうえで、適用法令、保護具、記録の順に照合してください。いきなり数値へ飛ぶと主語を外しやすいため、判断順序の維持が重要です。 試験では高温低温管理をセットで確認してください。 誤答では熱中症対策だけで十分と考え、低温環境の配慮措置を落とす。に注意してください。
oxygen-mask-mis-s34,酸欠作業で防毒マスクを選ぶミス,労働衛生,酸素欠乏症;保護具,酸欠作業で防毒マスクを選択する誤りを整理します。,送気系選択の欠落。,"[{""topic"": ""法令"", ""wrong"": ""法令確認なし"", ""correct"": ""酸素欠乏症等防止規則を確認"", ""trap"": ""法令失念""}, {""topic"": ""測定"", ""wrong"": ""測定省略"", ""correct"": ""酸素欠乏・硫化水素の測定を実施"", ""trap"": ""測定漏れ""}, {""topic"": ""保護具"", ""wrong"": ""防毒マスクで代替"", ""correct"": ""呼吸用保護具の選定と着用適合性検査を実施"", ""trap"": ""選定誤り""}, {""topic"": ""体制"", ""wrong"": ""監視人不要"", ""correct"": ""酸素欠乏危険作業主任者と監視体制を整備"", ""trap"": ""体制不足""}]",酸欠保護具選択ミス対策｜S34,酸欠は送気系保護具と監視体制を同時確認する必要があります。 試験では実務運用まで確認してください。,酸欠則;測定;保護具選定;体制,防毒マスクで足りると誤解し、送気系選定と監視体制を省く。,酸欠は測定後に保護具を選ぶ順序を守る。,酸素欠乏症等防止規則;呼吸用保護具の選定と着用適合性検査;酸素欠乏危険作業主任者,酸欠保護具ミスで最重要の確認点は？,酸欠保護具ミスは対象作業、管理措置、記録、教育の順で確認すると誤答が減ります。主語を確定してから数値を確認する手順を固定してください。 試験では酸欠則をセットで確認してください。 誤答では防毒マスクで足りると誤解し、送気系選定と監視体制を省く。に注意してください。,よくあるミスは？,法令名の取り違え、対象作業の過不足、保護具や記録の省略が典型です。比較表を用いて差分を見える化すると実務にも直結します。 試験では酸欠則をセットで確認してください。 誤答では防毒マスクで足りると誤解し、送気系選定と監視体制を省く。に注意してください。,試験直前の学習法は？,誤答肢だけを抜き出し、同一テーマの逆転肢を連続で確認する方法が有効です。新規範囲を広げるより、既出弱点の穴埋めを優先してください。 試験では酸欠則をセットで確認してください。 誤答では防毒マスクで足りると誤解し、送気系選定と監視体制を省く。に注意してください。,本番で迷った場合の対処は？,対象作業を確定したうえで、適用法令、保護具、記録の順に照合してください。いきなり数値へ飛ぶと主語を外しやすいため、判断順序の維持が重要です。 試験では酸欠則をセットで確認してください。 誤答では防毒マスクで足りると誤解し、送気系選定と監視体制を省く。に注意してください。
organic-tokuka-mixup-mis-s34,有機溶剤第2種と特化則の混同ミス,労働衛生,第2種有機溶剤;特定化学物質,有機溶剤第2種と特定化学物質の法令を混同するミスを整理します。,法令名の取り違え。,"[{""topic"": ""対象"", ""wrong"": ""同一対象と判断"", ""correct"": ""第2種有機溶剤と特定化学物質を分離"", ""trap"": ""対象混同""}, {""topic"": ""法令"", ""wrong"": ""有機則と特化則を混同"", ""correct"": ""有機溶剤中毒予防規則/特定化学物質障害予防規則を区別"", ""trap"": ""法令誤り""}, {""topic"": ""主任者"", ""wrong"": ""主任者不要"", ""correct"": ""特定化学物質作業主任者を確認"", ""trap"": ""要件漏れ""}, {""topic"": ""測定"", ""wrong"": ""測定不要"", ""correct"": ""作業環境測定を実施"", ""trap"": ""測定漏れ""}]",有機溶剤特化則混同ミス対策｜S34,対象物質→法令→主任者の順で確認すると混同を防げます。 試験では実務運用まで確認してください。,対象分離;法令区別;主任者;測定,有機溶剤の知識で特化則問題を解き、主任者論点を落とす。,物質名から法令を確定して解く。,第2種有機溶剤;有機溶剤中毒予防規則;特定化学物質障害予防規則,有機特化混同ミスで最重要の確認点は？,有機特化混同ミスは対象作業、管理措置、記録、教育の順で確認すると誤答が減ります。主語を確定してから数値を確認する手順を固定してください。 試験では対象分離をセットで確認してください。 誤答では有機溶剤の知識で特化則問題を解き、主任者論点を落とす。に注意してください。,よくあるミスは？,法令名の取り違え、対象作業の過不足、保護具や記録の省略が典型です。比較表を用いて差分を見える化すると実務にも直結します。 試験では対象分離をセットで確認してください。 誤答では有機溶剤の知識で特化則問題を解き、主任者論点を落とす。に注意してください。,試験直前の学習法は？,誤答肢だけを抜き出し、同一テーマの逆転肢を連続で確認する方法が有効です。新規範囲を広げるより、既出弱点の穴埋めを優先してください。 試験では対象分離をセットで確認してください。 誤答では有機溶剤の知識で特化則問題を解き、主任者論点を落とす。に注意してください。,本番で迷った場合の対処は？,対象作業を確定したうえで、適用法令、保護具、記録の順に照合してください。いきなり数値へ飛ぶと主語を外しやすいため、判断順序の維持が重要です。 試験では対象分離をセットで確認してください。 誤答では有機溶剤の知識で特化則問題を解き、主任者論点を落とす。に注意してください。
tokuka-supervisor-mis-s34,特化則で作業主任者を忘れるミス,労働衛生,特定化学物質;作業主任者,特化則問題で作業主任者選任論点を落とすミスを整理します。,主任者要件の見落とし。,"[{""topic"": ""法令"", ""wrong"": ""法令未確認"", ""correct"": ""特定化学物質障害予防規則を確認"", ""trap"": ""法令漏れ""}, {""topic"": ""主任者"", ""wrong"": ""選任不要"", ""correct"": ""特定化学物質作業主任者を選任"", ""trap"": ""要件不足""}, {""topic"": ""測定"", ""wrong"": ""測定省略"", ""correct"": ""作業環境測定を実施"", ""trap"": ""管理不足""}, {""topic"": ""記録"", ""wrong"": ""記録不要"", ""correct"": ""作業環境測定記録を保存"", ""trap"": ""証跡不足""}]",特化則主任者見落としミス対策｜S34,特化則は主任者選任と記録管理をセットで確認してください。 試験では実務運用まで確認してください。,特化則;主任者選任;測定;記録,法令名だけ覚えて主任者要件を確認せず、正誤を取り違える。,特化則は主任者論点から先に確認する。,特定化学物質障害予防規則;特定化学物質作業主任者;作業環境測定記録,特化主任者ミスで最重要の確認点は？,特化主任者ミスは対象作業、管理措置、記録、教育の順で確認すると誤答が減ります。主語を確定してから数値を確認する手順を固定してください。 試験では特化則をセットで確認してください。 誤答では法令名だけ覚えて主任者要件を確認せず、正誤を取り違える。に注意してください。,よくあるミスは？,法令名の取り違え、対象作業の過不足、保護具や記録の省略が典型です。比較表を用いて差分を見える化すると実務にも直結します。 試験では特化則をセットで確認してください。 誤答では法令名だけ覚えて主任者要件を確認せず、正誤を取り違える。に注意してください。,試験直前の学習法は？,誤答肢だけを抜き出し、同一テーマの逆転肢を連続で確認する方法が有効です。新規範囲を広げるより、既出弱点の穴埋めを優先してください。 試験では特化則をセットで確認してください。 誤答では法令名だけ覚えて主任者要件を確認せず、正誤を取り違える。に注意してください。,本番で迷った場合の対処は？,対象作業を確定したうえで、適用法令、保護具、記録の順に照合してください。いきなり数値へ飛ぶと主語を外しやすいため、判断順序の維持が重要です。 試験では特化則をセットで確認してください。 誤答では法令名だけ覚えて主任者要件を確認せず、正誤を取り違える。に注意してください。
occupational-physician-duty-mis-s34,産業医を名義だけにするミス,関係法令,産業医;巡視,産業医を選任のみで職務未実施にするミスを整理します。,選任後運用の欠落。,"[{""topic"": ""選任"", ""wrong"": ""名義のみ"", ""correct"": ""産業医を実運用"", ""trap"": ""形式選任""}, {""topic"": ""職務"", ""wrong"": ""巡視不要"", ""correct"": ""産業医の職務・巡視・意見具申を実施"", ""trap"": ""職務漏れ""}, {""topic"": ""連携"", ""wrong"": ""連携不要"", ""correct"": ""衛生管理者と共有"", ""trap"": ""連携不足""}, {""topic"": ""委員会"", ""wrong"": ""委員会不参加"", ""correct"": ""衛生委員会で意見反映"", ""trap"": ""反映不足""}]",産業医職務未実施ミス対策｜S34,産業医は選任後の職務実施まで含めて評価されます。 試験では実務運用まで確認してください。,実運用;巡視;連携;委員会反映,選任書類のみで満足し、巡視・意見具申を行わない。,産業医は選任後の職務実施を必ず確認する。,産業医;産業医の職務・巡視・意見具申;衛生管理者,産業医職務ミスで最重要の確認点は？,産業医職務ミスは対象作業、管理措置、記録、教育の順で確認すると誤答が減ります。主語を確定してから数値を確認する手順を固定してください。 試験では実運用をセットで確認してください。 誤答では選任書類のみで満足し、巡視・意見具申を行わない。に注意してください。,よくあるミスは？,法令名の取り違え、対象作業の過不足、保護具や記録の省略が典型です。比較表を用いて差分を見える化すると実務にも直結します。 試験では実運用をセットで確認してください。 誤答では選任書類のみで満足し、巡視・意見具申を行わない。に注意してください。,試験直前の学習法は？,誤答肢だけを抜き出し、同一テーマの逆転肢を連続で確認する方法が有効です。新規範囲を広げるより、既出弱点の穴埋めを優先してください。 試験では実運用をセットで確認してください。 誤答では選任書類のみで満足し、巡視・意見具申を行わない。に注意してください。,本番で迷った場合の対処は？,対象作業を確定したうえで、適用法令、保護具、記録の順に照合してください。いきなり数値へ飛ぶと主語を外しやすいため、判断順序の維持が重要です。 試験では実運用をセットで確認してください。 誤答では選任書類のみで満足し、巡視・意見具申を行わない。に注意してください。
